filename,transcript,grammar_score,corrected_text
audio_48.wav, Too bad I don't understand. I'm so sorry. I'm so sorry. I'm so sorry. I'm so sorry. I'm so sorry. I'm so sorry. I'm so sorry. I'm so sorry. I'm so sorry. I'm so sorry. I'm so sorry. I'm so sorry. I'm so sorry. I'm so sorry. I... I... I've finally prayed. I'm going to have to go to the bathroom. I'm going to have to go to the bathroom. I'm going to have to go to the bathroom. I'm going to have to go to the bathroom. I'm going to have to go to the bathroom. Well. Well. Well. I'm not going to be able to do it. I'm not going to be able to do it. I'm not going to be able to do it. I'm not going to be able to do it. I'm not going to be able to do it. I'm not going to be able to do it. I'm not going to be able to do it.,3.6821716,I'm so sorry. I'm so sorry. I'm so sorry. I'm so sorry. I'm so sorry. I'm so sorry. I'm so sorry. I'm going to have to go to the bathroom. I'm going to have to go to the bathroom. I'm going to have to go to the bathroom. Well. Well. Well. Well. Well. Well. Well. Well. Well. Well. Well. Well. Well. Well. Well. Well. Well. Well I'm not going to be able to do it. I'm not going to be able to do it. I'm not going to be able to do it.
audio_308.wav," The best day of my life, I think it was the first time I went to my team stadium because it felt very special to me that everyone was wearing the same color as me and I felt a sense of belonging because everyone felt the same way as me about that stuff in particular. And also was very important to that we won that game and against our biggest rival and that everyone says is the best match that happened in that stadium and that made us win the championship and it was a very special game. I feel good thinking about that game but I don't think it made a difference.",3.413453,"The best day of my life, I think it was the first time I went to my team stadium because it felt very special to me that everyone was wearing the same color as me and I felt a sense of belonging because everyone felt the same way as me about that stuff in particular. And also was very important to that we won that game and against our biggest rival and that everyone says is the best match that happened in that stadium and that made us win the championship and it was a very special game. I feel good thinking about that game but I don't think it made a difference."
audio_746.wav," Hi, my description about the crowded market. Yeah, when I go to crowded market, I can see people are selling vegetables, fruits, meat, shrimp, chicken, ducks, etc. and the vegetables, fruits are sold in a very affordable price. And you can hear many sounds in the market like the sellers or the vendors calling the people first by showing them discount and offers like buy one get one in the sense of packages and the crowded market scene in the morning looks so huge as the",3.8360555,"I'm going to crowded market and I can see people selling vegetables, fruits, meat, shrimp, chicken, ducks, etc. and you can hear many sounds in the market like the sellers or vendors calling the people first by showing them discounts and offers like buy one get one in the sense of packages. And the crowded market scene in the morning looks so huge as the people are selling vegetables, fruits, meat, shrimp, chicken, ducks, etc. and you can hear many sounds in the market like the sellers or vendors calling the people"
audio_1019.wav," I have a very large playground in my school. We play cricket, Kabaddi. In my playground, my PET was very good to teach us how to play different games in very fashion play. He encouraged us to play the games. We are very early waiting to play the games at that time.",2.0932682,"I have a very large playground in my school. We play cricket, Kabaddi. In my playground, my PET was very good to teach us how to play different games in very fashion play. He encouraged us to play the games. We are very early waiting to play the games at that time."
audio_487.wav, I'm not a dog. I'm not a dog. I'm not a dog. I'm not a dog. I'm not a dog. I'm not a dog. I'm not a dog. I'm not a dog. I'm not a dog. I'm not a dog. I'm not a dog. I'm not a dog. I'm not a dog. I'm not a dog. I'm not a dog. I'm not a dog. I'm not a dog. I'm not a dog. I'm not a dog. I'm not a dog. I'm not a dog.,2.956126,I'm not a dog. I'm not a dog. I'm not a dog. I'm not a dog. I'm not a dog. I'm not a dog. I'm not a dog. I'm not a dog. I'm not a dog. I'm not a dog. I'm not a dog.
audio_198.wav," It's a very special night so I create weight and a reassurement soon. From this is a lot of onions and hot fine with a room of freshly baked bread filling. The kitchen, every moment fine cooking is a delightful journey of flavours and textures. Exploring various cuisines and experimenting that different ingredients excites me whether it's mastering art of bench face freeze, about 13 spy seas and in an Indian clay, I find joy in the process of learning and honing my culinary skills. Cooking allow me to express myself creatively like an artist, feeling a palette of flavours I enjoy. Challenges of cropping dishes that not only taste delicious but also look visually appealing. More over cooking some beef for me to connect with others, whether I am hosting a dinner party for friends or preparing a home made meal for my family. Like of sharing food things with my dogata creates cherish memories.",3.6614985,"It's a very special night so I create weight and a reassurement soon. From this is a lot of onions and hot fine with a room of freshly baked bread filling. The kitchen, every moment fine cooking is a delightful journey of flavours and textures. Cooking allows me to express myself creatively like an artist, feeling a palette of flavours I enjoy. Challenges of cropping dishes that not only taste delicious but also look visually appealing. More over cooking some beef for me to connect with others, whether I am hosting a dinner party for friends or preparing a home made meal for my family. Like sharing food things with my dogata creates cherish memories."
audio_958.wav," in the air, spring, song, back and forth, prepared by eager feet with the merry go round. Groups of friends handled together, chatting animatedly or playing games of Taigan, hopscotch, the basketball court responded with the third of dribbling balls and the switch of basketball. In one corner, children giggled as the navigated in jungle gym, climbing, sliding and balancing with carefree, a bed on. The aim was alive with the sounds of youthful evidence, a vibrant symphony of playfulness and joy. The school playground is a dynamic space where children gathered to socialize play, engaged in physical activity.",3.87473,"The aim was alive with the sounds of youthful evidence, a vibrant symphony of playfulness and joy. The school playground is a dynamic space where children gather to socialize play, engage in physical activity."
audio_72.wav," At this market you can find a lot of things. Actually I can see that some people are selling and to hit us for breakfast also and I'm seeing that you can find a lot of books. Old books, all kind of things. Actually also you can find some pets or animals like fearshobeards. Also you can find, oh my god that's a little cow and sheep. The market, well it sounds like a lot of people are talking. A lot of people are running one side from another. And also you can hear all the cars and the art from the near avenue. Also well at the beginning of the day the market is like a full of people throwing the day, there are the last people.",3.9029171,"Actually I can see that some people are selling and to hit us for breakfast also and I'm seeing that you can find a lot of books. Old books, all kinds of things. Actually you can also find some pets or animals like fearshobeards. Also you can find, oh my god, a little cow and sheep. The market sounds like a lot of people are talking. Also, at the beginning of the day the market is like a full of people throwing the day, there are the last people."
audio_1321.wav, Can you describe the journey or travel experience getting to this destination? Are there any local foods or dishes from this place that you love? It's a particular time of the year season when this place is especially modular and beautiful. So actually I want to go to the Thailand and Chamme Tei land because there is a lot of food and also the culture is same as in the Philippines. The people in their love their traditions and also their select of beautiful places such as the night market where all the foods or all the tourist can find food or their traditional food from the Thailand. So that's why I love to visit Thailand. I love to visit Thailand.,3.204718,Can you describe the journey or travel experience getting to this destination? Are there any local foods or dishes from this place that you love? It's a particular time of the year season when this place is especially modular and beautiful. So actually I want to go to Thailand and Chamme Tei land because there is a lot of food and also the culture is the same as in the Philippines. I love to visit Thailand because of their traditions and also their selection of beautiful places such as the night market where all the food or tourists can find food or their traditional food from the Thailand.
audio_1159.wav, Yn yw'n gweld. Yn yw'n gweld. Yn yw'n gweld. Yn yw'n gweld. Yn yw'n gweld. Yn yw'n gweld. Yn yw'n gweld. Yn yw'n gweld. Yn yw'n gweld. Yn yw'n gweld. Yn yw'n gweld. Yn yw'n gweld. Yn yw'n gweld. Yn yw'n gweld. Yn yw'n gweld. Yn yw'n gweld. Yn yw'n gweld. Yn yw'n gweld. Yn yw'n gweld. Yn yw'n gweld. Yn yw'n gweld. Yn yw'n gweld. Yn yw'n gweld. Yn yw'n gweld. Yn yw'n gweld. Yn yw'n gweld. Yn yw'n gweld. Yn yw'n gweld. Yn yw'n gweld. Yn yw'n gweld. Yn yw'n gweld. Yn yw'n gweld. Yn yw'n gweld. Yn yw'n gweld. Yn yw'n gweld. Yn yw'n gweld. Yn yw'n gweld. Yn yw'n gweld. Yn yw'n gweld. Yn yw'n gweld. Yn yw'n gweld. Yn yw'n gweld. Yn yw'n gweld. Yn yw'n gweld. Yn yw'n gweld. Yn yw'n gweld. Yn yw'n gweld. Yn yw'n gweld. Yn yw'n gweld. Yn yw'n gweld. Yn yw'n gweld. Yn yw'n gweld. Yn yw'n gweld. Yn yw'n gweld. Yn yw'n gweld. Yn yw'n gweld. Yn yw'n gweld. Yn yw'n gweld. Yn yw'n gweld. Yn yw'n gweld. Yn yw'n gweld. Yn yw'n gweld. Yn yw'n gweld. Yn yw'n gweld. Yn yw'n gweld. Yn yw'n gweld. Yn yw'n gweld. Yn yw'n gweld. Yn yw'n gweld. Yn yw'n gweld. Yn yw'n gweld. Yn yw'n gweld. Yn yw'n gweld. Yn yw'n gweld. Yn yw'n gweld. Yn yw'n gweld. Yn yw'n gweld. Yn yw'n gweld. Yn yw'n gweld. Yn yw'n gweld. Yn yw'n gweld. Yn yw'n gweld. Yn yw'n gweld. Yn yw'n gweld.,3.3055234,Yn yw'n gweld. Yn yw'n gweld. Yn yw'n gweld. Yn yw'n gweld. Yn yw'n gweld. Yn yw'n gweld. Yn yw'n gweld. Yn yw'n gweld. Yn yw'n  Yn yw'n gweld. Yn yw'n gweld. Yn yw'n gweld. Yn yw'n gweld. Yn yw'n gweld. Yn yw'n gweld. Yn yw'n gweld. Yn yw'n gweld. Yn yw'n  Yn yw'n gweld. Yn yw'n gweld. Yn yw'n gweld. Yn yw'n gweld. Yn yw'n gweld. Yn yw'n gweld. Yn yw'n gweld. Yn yw'n gweld. Yn yw'n 
audio_428.wav, I'm going to have to go back to the next one. I'm going to have to go back to the next one. I'm going to have to go back to the next one. I'm going to have to go back to the next one. I'm going to have to go back to the next one. I'm going to have to go back to the next one. I'm going to have to go back to the next one. I'm going to have to go back to the next one. I'm going to have to go... ...to the first one. I'm going to get ready. Oh Oh Oh Oh,2.8405128,I'm going to have to go back to the next one. I'm going to have to go back to the next one. I'm going to have to go back to the next one. I'm going to have to go back to the first one. I'm going to get ready. Oh Oh Oh Oh Oh Oh Oh Oh Oh Oh Oh Oh Oh Oh Oh Oh! Oh Oh Oh Oh Oh Oh! Oh Oh Oh Oh Oh! Oh Oh Oh Oh! Oh Oh Oh Oh! Oh Oh Oh Oh! Oh Oh Oh!
audio_1058.wav," My favourite place to visit is Palm Springs, California. I first travelled there in 2010 and it was after a work conference in Las Vegas that was really hectic and it felt really magical because I got on a really small plane and the flight was really short and the airport as soon as we landed the airport was stunning, beautiful architecture or open air. Absolutely magical. My favourite restaurant there is Melbourne's. It was a hangout, favourite hangout of the rep pack and especially Frank Sinatra. He had his wedding there and stage of the honeymoon at the end of the store as well. I actually really liked being there in the middle of summer. It was absolutely stunning.",3.392483,"My favourite place to visit is Palm Springs, California. I first travelled there in 2010 and it was after a work conference in Las Vegas that was really hectic and it felt really magical because I got on a really small plane and the flight was really short and the airport as soon as we landed the airport was stunning, beautiful architecture or open air. Absolutely magical. I actually really liked being there in the middle of summer. It was absolutely stunning."
audio_408.wav," Alright, so let's try the scene of a school playground. Let's see, we can start by describing the school for an ounce of child. So it was very colorful. Lots of kids around my age. Lots of kids playing the half-scotch, a few kids playing tag, some of the playing dodgeball. Some of the younger kids playing ducked a goose. Overall, it's like a really nice day. It's very sunny. After like a long day of... After a long winter season. So it's how you're fine and we're just happy. And there it is, very peaceful. Yeah, it's a good day.",3.9075768,"Let's try the scene of a school playground. It was very colorful. Lots of kids around my age. Lots of kids playing half-scotch, a few kids playing tag, some of the younger kids playing dodgeball. Some of the younger kids playing duck a goose. Overall, it's like a really nice day. It's how you're fine and we're just happy. And there it is, very peaceful. Yeah, it's a good day.."
audio_857.wav, venturea mfindowel aarashrathasiipple ATSI Nancy na mri et sweets Kast下來 Enjoy ba Certain ei badlymeng Back Western ain't what its all p πο plk ju ...,2.9464006,The Back West isn't what it is all about.
audio_692.wav," Walmart is always busy. Even in the morning, people are on their way to work and they're just trying to grab something quick to eat or maybe some office supplies for whatever they need at work. The checkout lanes are always full and only two of them are always and there's only two of them open even though there's like 10 others that they could have a cashier at. People are usually in the hurry. You could buy just about anything from Walmart, video games, electronics, food, house stuff, house supplies, parks and crafts, toys, you name it. In the afternoons is very busy there. It's usually very crowded and hard to find a park is by. At night, you can get dangerous outside in the parking lot because they're a drug addicts and homeless people out there. It is best to go in, get what you need and get out as fast as possible.",3.890484,"Even in the morning, people are on their way to work and they're just trying to grab something quick to eat or maybe some office supplies for whatever they need at work. The checkout lanes are always full and there's only two of them open even though there are like 10 others that they could have a cashier at. You could buy just about anything from Walmart, video games, electronics, food, house stuff, house supplies, parks and crafts, toys, you name it. In the afternoons, it is usually very busy and you can get dangerous outside in the parking lot because there are drug addicts and homeless people out there."
audio_633.wav, My goal in life is to achieve complete and utter fulfillment. This goal is incredibly important to me because I feel that fulfillment is one of the keys to leading a happy life. The challenges that I would face to achieve this goal is everyday distractions getting caught up in day-to-day life and becoming fixated on material and financial gain versus actual fulfillment. One motivates me to stay focused and determined on the path to achieving this goal is my craving for fulfillment and I need to just be genuinely deeply happy in a non-material way.,3.3969746,My goal in life is to achieve complete and utter fulfillment. This goal is incredibly important to me because I feel that fulfillment is one of the keys to leading a happy life. The challenges that I would face to achieve this goal are everyday distractions getting caught up in day-to-day life and becoming fixated on material and financial gain versus actual fulfillment. One motivates me to stay focused and determined on the path to achieving this goal is my craving for fulfillment and I need to just be genuinely deeply happy in a non-material way.
audio_1173.wav," This might sound very cheesy, but I think my goal in life is to have a beautiful family. Because I've already really gotten into my career that I love and that was a goal, but now, even though I'm young, it's something I want in my future. To me, this is important because I love family values. And I think that one of my top priorities, raising, having a family, challenges I would face, oh, I guess, finding somebody who's fit to have children with, it has to be one person, you have to really make that person count. I don't really need any motivation because I'm pretty determined.",3.4828718,"This might sound very cheesy, but I think my goal in life is to have a beautiful family. Because I've already really gotten into my career that I love and that was a goal, but now, even though I'm young, it's something I want in my future. And I think that one of my top priorities, raising, having a family, challenges I would face, oh, I guess, finding somebody who's fit to have children with, it has to be one person, you have to really make that person count. I don't really need any motivation because I'm pretty determined."
audio_554.wav," I have a one goal to do which is to have my own business. This here I will finally take the first step and rent 10 the location and start it working on the material that I will be using so I can fix the place. I have, again, challenges will be to learn more about the way this is the business handle. I have a little bit of experience working on a location like that. But now it's going to be my own business so I have to learn counting, like management about all the items that I hope is selling.",3.0404642,"I have a one goal to do which is to have my own business. This is where I will finally take the first step and rent 10 the location and start working on the material that I will be using so I can fix the place. I will have to learn counting, like management, about all the items that I hope is selling."
audio_180.wav," My favorite hobby is playing video games. I've played video games my whole entire life. I guess starting when I was a little kid with Kirby superstar, oh sorry Kirby All Stars actually it wasn't even superstars All Stars. The thing that I like the most about my hobby is that it gives you a lot of different things. If you're playing a calming game I could help you relax. If you're playing a game that filled a lot of action, it could give you a lot of action. If you play games that are educational like typing games, I could help you get like gain a skill. But overall I mean I just like the adrenaline that some of the games give me.",3.5916557,"My favorite hobby is playing video games. I've played video games my whole life, starting when I was a little kid with Kirby All Stars, but actually it wasn't even superstars All Stars. The thing that I like the most about my hobby is that it gives you a lot of different things. If you're playing a game that filled a lot of action, it could give you a lot of action. I could help you gain a skill, but overall I just like the adrenaline that some of the games give me."
audio_1013.wav," The playground is full of sand, it's full of kids playing there. They make a lot of noise, some of them play in muddy paddles and there's jungle team for the kids to play with a lot of toys for the kids to play with and a lot of card games and a lot of games like your skipping rope games and many other games. The kids are roaming around, placing up and down, running around and they are happy, they are shouting and the songs that I'm hearing is stomping, it's them stomping with feet, them flipping their hands, them cheering, laughing, some of them crying, some are just streaming.",3.413453,"The playground is full of sand, it's full of kids playing there. They make a lot of noise, some of them play in muddy paddles and there's jungle team for the kids to play with a lot of card games and a lot of games like your skipping rope games and many other games. The kids are roaming around, placing up and down, running around and they are happy, they are shouting and the songs that I'm hearing is stomping, it's them stomping with feet, them flipping their hands, them cheering, laughing, some of them crying, some are just streaming."
audio_386.wav," Well, the playground I like to talk about is the school playground. The school playground is like a serene environment. We are children, get to enjoy themselves. It's multi-coloured. It's made up of different colours. It's natural colours and different drawings, abstracts as well. The playground is made up of different activities and different sections. We are children can play. You see some of the house obstacles, the chairs, the boat on the ground. You hear sounds of children laughing and enjoying themselves having fun. You hear voices of people just thinking about interesting topics.",3.5047374,"Well, the playground I like to talk about is the school playground. It's multi-coloured. It's made up of different colours, different drawings, abstracts as well. The playground is made up of different activities and different sections. We are children can play. You see some of the house obstacles, the chairs, the boat on the ground. You hear sounds of children laughing and enjoying themselves having fun. You hear voices of people just thinking about interesting topics."
audio_519.wav,Error: Audio file not found: dataset/audios_test\audio_519.wav,3.6009393,Error: Audio file not found: dataset/audios_testaudio_519.wav.
audio_564.wav,Error: Audio file not found: dataset/audios_test\audio_564.wav,3.6009393,Error: Audio file not found: dataset/audios_testaudio_564.wav.
audio_1054.wav," My favorite place is Jocfas and Gokarnand, Morday Fier because when I went there, I was in 10th class, my brother took me there with my sister in law and I was very happy in the journey like I was enjoying the V1 greenery where I went. When I was moved to the Jocfas, the Sarandha was very nice and it looked like it was totally greenery and it is also a good section so it was very nice to see the greenery and when I am going to Gokarnand, it was near to the beach, it was near to the ocean. The little crabs are coming out of the ocean and though the little crabs are very tiny, I can't imagine these tiny crabs are there in the",3.4870913,"My favorite place is Jocfas and Gokarnand, Morday Fier because when I went there, I was in 10th class, my brother took me there with my sister in law and I was very happy in the journey like I was enjoying the greenery and when I am going to Gokarnand, it was near to the beach and the ocean. The little crabs are coming out of the ocean and though the little crabs are very tiny, I can't imagine these tiny crabs are there in the ocean."
audio_556.wav," My goal in life is to be the best version of myself. By the best version I mean the most healthy version. That means being on a strict diet, low sugar, low carb, just overall trying to eat healthy. No sugary drinks, drink water instead. Water and tea. Get a lot of sleep, plenty of sleep. Take care of my body by exercising at least three times a week. Stay away from anything that will hold me back. So no smoking, no drinking. Basically just overall just protecting myself. So I can live long and healthy life. That is my overall goal right now.",3.413453,"My goal in life is to be the best version of myself. That means being on a strict diet, low sugar, low carb, just overall trying to eat healthy. No sugary drinks, drink water instead. Get a lot of sleep, plenty of sleep. Take care of my body by exercising at least three times a week. Stay away from anything that will hold me back. Basically, just overall just protecting myself. So I can live a long and healthy life, that is my overall goal right now."
audio_1183.wav, I'm not a doctor. I'm not a doctor. I'm not a doctor. I'm not a doctor. I'm not a doctor. I'm not a doctor. I'm not a doctor. I'm not a doctor. I'm not a doctor. I'm not a doctor. I'm not a doctor. I'm not a doctor. I'm not a doctor. I'm not a doctor. I'm not a doctor. I'm not a doctor. I'm not a doctor. I'm not a doctor. I'm not a doctor.,3.9987166,I'm not a doctor. I'm not a doctor. I'm not a doctor. I'm not a doctor. I'm not a doctor. I'm not a doctor. I'm not a doctor. I'm not a doctor.
audio_306.wav, I think the best in my life is my body. On my body I enjoy a lot with my friends and with my cousins. I spend the day by going on a trip and to a water place. I feel very happy by thinking about the day. I spend my whole day with my cousins and my close friends. But I really missed one person on the day. She is my best friend. But she missed one day. So I feel a little bit better for her. It's my special...,3.633851,I think the best in my life is my body. I spend my whole day with my friends and with my cousins. I spend the day by going on a trip and to a water place. I feel very happy by thinking about the day. I really missed one person on the day. She missed one day. So I feel a little better for her. It's my special.
