filename,transcript,grammar_score,corrected_text
audio_706.wav," A market place is an exceptionally bustling spot where individuals go to purchase things of their needs. It is a focal point of vaccination for the two purchases and vendors. There is no other place in the zone having so much lively business as the market. I generally locate a major group there. There are few shops all enhanced and perfectly. The normal shops look more alluring representatives come here from distant locations abroad to purchase or to sell their items. The market is constantly swam with the trucks, horses, donkeys and camels. They come stuck with the production of this season, for example cotton, grain, oil seats, tables and so on. As the cost of the things are not set is, the sellers and in addition the buyers.",4.011839,"The market is an exceptionally bustling spot where individuals go to purchase things of their needs. It is a focal point of vaccination for the two purchases and vendors. There is no other place in the zone having so much lively business as the market. I generally locate a major group there. There are few shops all enhanced and perfectly. The normal shops look more attractive representatives come here from distant locations abroad to purchase or sell their items. The market is constantly swam with trucks, horses, donkeys and camels. They come stuck with the production of this season, for example cotton, grain, oil seats, tables and so on."
audio_800.wav," My favorite hobby is reading, I love getting lost in a good book and escaping into different words and characters. Reading helped me to relax and unwind after a long day. And it also helps me to know about new things and expand the origin of my knowledge. Also enjoy writing and I often find myself jotting down ideas for stories or poems in my spare time. Writing allows me to express my creativity and explore different ideas and perspectives. Overall my favorite hobby is one that allows me to engage my mind and explore my interests and passions. Whether it's reading or writing, I always feel fulfilled and regimented after including in my favorite hobbies. There is no other work that brings me more joy.",3.954985,"My favorite hobby is reading, I love getting lost in a good book and escaping into different words and characters. Reading helped me relax and unwind after a long day. And it also helps me to know about new things and expand the origin of my knowledge. Also enjoy writing and I often find myself jotting down ideas for stories or poems in my spare time. Overall, my favorite hobby is one that allows me to engage my mind and explore my interests and passions. Whether it's reading or writing, I always feel fulfilled and regimented after including in my favorite hobbies. There is no other work that brings me more joy."
audio_68.wav," Yeah, I have a soy crowded market. There are different types of people out there. It's very crowded with a large number of people. On one side, there are some people who are selling vegetables, some people are selling fruits, and some are selling other essential products that are required for the humans. And when I hear here's about the market, it's a fascinating thing that there will be a large number of the people. And from morning to evening, people work hard there to fed up themselves for their feed and all. And it's very... that's it.",3.603638,"Yeah, I have a very crowded market. There are different types of people out there. It's very crowded with a large number of people. On one side, there are some people who are selling vegetables, some people are selling fruits, and some are selling other essential products that are required for the humans. And from morning to evening, people work hard there to feed themselves for their feed and all. And it's very... that's it."
audio_1267.wav, My favorite hobby is writing. I have a flip for writing. I enjoy writing on a variety of topics. Okay. I enjoy writing because it helps me to express myself. It helps me to express my feelings. And I am down. And I am passing through difficult times. I like to take records. I am happy. I take records. Writing is my strongest point to express myself. I need to use my pen. I need some software like WPS. I enjoy writing. I don't really write to people. But I can only look for.,3.5794847,I enjoy writing because it helps me to express myself. It helps me to express my feelings. And I am down. And I am passing through difficult times. I like to take records. I am happy. I take records. I enjoy writing. I don't really write to people. But I can only look for.
audio_683.wav," Okay, in a product market, basically, I have a smear of overwhelmed scenes, no vendors calling out their whiz and some of them selling clothes, some of them selling shoes, pads, and the commercial voices of their warts, basically blending into the firebrands and languages. And the A is thick with aroma, you know, it can smell spices of foodstuffs and, you know, people walking around, people trying to hurry up and get work and they've come to buy and lift the market and we're scrawded. You can see people just, you know, walking around, there are sounds of different voices and calling out customers, calling out their customers, but it can't check their goods.",4.0729594,"Okay, in a product market, basically, I have a smear of overwhelmed scenes, no vendors calling out their whiz and some of them selling clothes, some of them selling shoes, pads, and the commercial voices of their warts, basically blending into the firebrands and languages. And the A is thick with aroma, you know, it can smell spices of foodstuffs and, you know, people walking around, people trying to hurry up and get work, and they've come to buy and lift You can see people just walking around, there are sounds of different voices calling out customers, calling out their customers, but it can't check their goods."
audio_1242.wav," My favorite place is Kerala. I would love to visit Kerala. In the Kerala there are so many special places like Dronandapuram, Long Swing and much many more. Traveling experience is we can go by flight, train, car but most preferable is bike from Andhra to Kerala roadway trip. There are some local foods like banana chips, Kerala biryani, Jagford biryani, Tirunandapuram, food and many more. There is a particular time to visit. Mostly we can visit in summer and winter but in winter we can see the pleasant environment, green fields and much more.",3.450292,"My favorite place is Kerala. I would love to visit Kerala. There are some local foods like banana chips, Kerala biryani, Jagford biryani, food and many more. There is a particular time to visit. Mostly we can visit in summer and winter, but in winter we can see the pleasant environment, green fields and much more."
audio_908.wav, The best day of my life is event Monali with my friends and the rupees of 10 days and the best day of my life is when we went to Gautam Pass and we had a lot and so it's for all of you that to visit the place of Gautam Pass where you can experience many many many the joyfulness and excitement of the city the mountains the days and the cool and the loneliness have made my it's special actually and I feel I feel chill there while when I think about the day which was passing and we had a lot as much as possible I reference all to visit the place where Gautam Pass in the place.,3.413453,"The best day of my life is event Monali with my friends and the rupees of 10 days and the best day of my life is when we went to Gautam Pass and we had a lot and so it's for all of you that you visit the place where Gautam Pass is located and you can experience many many many joys and excitement of the city, mountains, the days and the cool and the loneliness have made my it's special actually and I feel I feel chill there while when I think about the day which was"
audio_888.wav," The best day of my life is it started in Chinmaya Mission, in Chinmaya Mission. I had learned many things. I had been selected as a yoga practitioner. I had been selected as a good drawing expert. I received this third present in drawing, apart from this I selected the top 10 in the yoga part. In this way, Chinmaya Institute teach me very good under productive knowledge. In Chinmaya Institute taught me how a good human being will survive in your life. This way, in Chinmaya Mission, I lead my team in a better way to achieve all his team goals. So that's why I had to say the best result of their award. Also on that day, I discussed the best day in my life. So I cannot forget the day. So this way, I want to describe the best day of my life, which I was spending in Chinmaya Mission that's all.",3.7688751,"The best day of my life is it started in Chinmaya Mission, in Chinmaya Mission. I had learned many things. I had been selected as a yoga practitioner. I had been selected as a good drawing expert. I had been selected as a top 10 in the yoga part. In this way, Chinmaya Institute taught me how a good human being will survive in your life. This way, in Chinmaya Mission, I lead my team in a better way to achieve all their team goals. So that's why I had to describe the best day of my life, which I was spending in Chinmaya Mission."
audio_137.wav," So, the topic is the scene of the crowded market. So, after the COVID, after the COVID, the market is very crowded. So, the people are buying and selling new technologies and new features of phones, laptop and electronic devices. So, that they can easily work them. And most likely, we can hear in the market is like cheap products and good features and good technologies that are inside it. And throughout the technologies, increasing day by day, all people are by only technology-related products like mobile, laptops, tablets, earbuds and Bluetooth connecting devices. Thank you.",3.4104304,"So, the topic is the scene of the crowded market. So, after the COVID, after the COVID, the market is very crowded. So, the people are buying and selling new technologies and new features of phones, laptops and electronic devices, so that they can easily work them. And most likely, we can hear in the market is cheap products and good features and good technologies that are inside it. And throughout the technologies, increasing day by day, all people are by only technology-related products like mobile, laptops, tablets, earbuds and Bluetooth connecting devices. Thank you."
audio_770.wav," My hobby is to sing. I am a chaotic musician. I have started learning, I am not a musician from my childhood. I love to sing very much. When I sing, I feel very happy. I will be excited. My mood will be very happy. I enjoy singing. I have a shorty box which helps me to control my breath to sing within the tune. It can adjust my pitch etc. I love singing alone as well as singing as a team, as a group, performing group songs etc. I am to become a singer and a future. I will definitely become a singer. And I...",3.413453,"I am a chaotic musician. I have started learning, I am not a musician from my childhood. I love to sing very much. When I sing, I feel very happy. I will be excited. My mood will be happy. I enjoy singing. I love singing alone as well as singing as a team, as a group, performing group songs etc. I am to become a singer and a future. I will definitely become a singer. And I will definitely become a singer."
audio_735.wav, 1.0.1.1.1.1.1.1.1.1.1.1.1.1.1.1.1.1.1.1.1.1.1.1.1.1.1.1.1.1.1.1.1.1.1.1.1.1.1.1.1.1.1.1.1.1.1.1.1.1.1.1.1.1.1.1.1.1.1.1.1.1.1.1.1.1.1.1.1.1.1.1.1.1.1.1.1.1.1.1.1.1.1.1.1.1.1.1.1.1.1.1.1.1.1.1.1.1.1.1.1.1.1.1.1.1.1.1.1.1.1.1 1.0.7.7.7.7.7.7.7.7.7.8.1.1.1.2.1.2.1.2.1.1.1.2.1.2.1.2.2.2.2 2.3 3 4.4.4.4.5.8.4.4.4.2.2.2.2.2.2.2.2.3.2.2.2.1.1.1.1.2.2.2.2.2.2.2.4.2.2.2.2.2.2.2.2.2.2.2.2 1.0-1-1-1-1-1-1-1-1-1-1-1-1-1-1-1-1-1-1-1-1-1-1-1-1-1-1-1-1-1-1-1-1-1-1-1-1-1-1-1-1-1-1-1-1-1-1-1-1-1-1-1-1-1-1-1-1-1-1-1-1-1-1-1-1-1-1-1-1-1-1-1-1-1-1-1-1-1-1-1-1-1-1-1-1-1-1-1-1-1-1-1-1-1-1-1-1-1-1-1-1-1-1-1-1-1-1-1-1-1-1 1.0.1.1.1.1.1.1.1.1.1.1.1.1.1.1.1.1.1.1.1.1.1.1.1.1.1.1.1.1.1.1.1.1.1.1.1.1.1.1.1.1.1.1.1.1.1.1.1.1.1.1.1.1.1.1.1.1.1.1.1.1.1.1.1.1.1.1.1.1.1.1.1.1.1.1.1.1.1.1.1.1.1.1.1.1.1.1.1.1.1.1.1.1.1.1.1.1.1.1.1.1.1.1.1.1.1.1.1.1.1.1 2.3.3.3.3.3.3.3.3.3.3.3.3.3.3.3.3.3.3.3.3.3.3.3.3.3.3.3.3.3.3.3.3.3.3.3.3.3.3.3.3.3.3.3.3.3.3.3.3.3.3.3.3.3.3.3.3.3.3.3.3.3.3.3.3.3.3.3.3.3.3.3.3.3.3.3.3.3.3.3.3.3.3.3.3.3.3.3.3.3.3.3.3.3.3.3.3.3.3.3.3.3.3.3.3.3.3.3.3.3.3,4.15362,1.0.1.1.1.1.1.1.1.1.1.1.1.1.1.1.1.1.1.1.1.1.1.1.1.1.1.1.1.1.1.1.1.1.1.1.1.1.1.1.1.1.1.1.1.1.1.1.1.1.1.1.1.1.1.1.1.1.1.1.1.1.1.1.1.1.1.1.1.1.1.1.1.1.1.1.1.1.1.1.1.1.1.1.1.1.1.1.1.1.1.1.1.1.1.1.1.1.1.1.1.1.1.1.1.1.1.1.1.1.1.1.
audio_1026.wav," My school playground is small inside because it's a similar to government school and moreover in that small place we used to play a lot, we used to play dodgeball and you know like everything, everything and all my three morning prayers are done in the same ground and we used to play weekly once for 15 minutes in that playground and which we should be very happy and most of the students are very interested to play games there and I think here one of the most of them",3.658238,"My school playground is small inside because it's a similar to government school and moreover in that small place we used to play a lot, we used to play dodgeball and you know, everything, and all my morning prayers are done in the same ground and we used to play weekly once for 15 minutes in that playground and which we should be very happy and most of the students are very interested to play games there and I think one of the most interesting things is that they are playing dodgeball and I think they are very interested in playing games there"
audio_1214.wav," I have been to the supermarket and I have seen a lot of people, it is very crowded in the supermarket and the most of the people are purchasing electronics which has an offer for the festival sale. I heard the most of the announcements on the electronics which are offered on the day. At the when I entered the morning, the market is fully crowded and it comes to the evening and it is empty. The people most of them are purchase, relax, give us and free gifts and gaming consoles.",3.5282378,I have been to the supermarket and I have seen a lot of people. It is very crowded in the supermarket and the most of the people are purchasing electronics which have an offer for the festival sale. I heard the most of the announcements on the electronics which are offered on the day.
audio_1122.wav," The goal of my life is to become a software developer because I would like to do something for my country to make me proud and my parents as well. By building a software I will able to make the future generation to be able to use and will be able to use this thing so that they are helpful to them. The challenges I would face to achieve this goal is to learn a lot of things like new technology and new technologies and gaining lots of knowledge and experience about what is current situation happening, what is new technologies come my motivation to stay focused is my parents who are going to encourage me and my cousins who give me motivation for",3.4870913,"The goal of my life is to become a software developer because I would like to do something for my country to make me proud and my parents as well. By building a software I will be able to make the future generation to be able to use and will be able to use this thing so that they are helpful to them. The challenges I would face to achieve this goal is to learn a lot of things like new technology and new technologies and gain lots of knowledge and experience about what is current situation happening, what is new technologies coming my motivation to stay focused is my parents who are going to encourage me and my cousins who give me motivation for."
audio_1022.wav, The play drone looked like a very joyful play. Very joyful place to me and all of my friends. We spent a lot of time in a happy manner with our fellow friends and the other students. There will be so much time for us to play various games and activities. Some of us will play cricket on the ground. Some of us will play basketball in the court. And some of some students will sing songs and others and grace them. And some of the students will dance around each other. And they hear very joy.,3.5794847,The play drone looked like a very joyful play. Very joyful place for me and all of my friends. There will be a lot of time for us to play various games and activities. Some of us will play cricket on the ground. Some of us will play basketball on the court. And some of the students will sing songs and others and grace them. And some of the students will dance around each other. And they hear very joy.
audio_726.wav," And the profit is in a described scene of the crowded market, especially in a crowded market. One in times the crowd is more. And the sales people can speak the cost of their natum. Yeah.",2.5169835,"And the profit is in a described scene of the crowded market, especially in a crowded market. One in times the crowd is more. And the sales people can speak the cost of their natum. Yeah."
audio_1205.wav," A market place is a very busy place where people go to buy articles of their needs. It is a center of attraction for both myers and sellers. There is no other place in the area. I have been so much in this busy business as the market. I always find it being crowded. There are several shops all decorated beautifully. Big shops look more attractive. Businessmen come here from far and wide, so purchasing or selling their products. The market is always crowded with cards, boxes, dummies and panels. They come loaded with the produce of a season such as cotton, grey, oilisings, visitables, etc.",3.0833821,"The market is a very busy place where people go to buy articles of their needs. It is a center of attraction for both myers and sellers. There is no other place in the area. I have been so much in this busy business as the market. I always find it being crowded. There are several shops all decorated beautifully. Businessmen come here from far and wide, so purchasing or selling their products. They come loaded with the produce of a season such as cotton, grey, oilisings, visitables, etc."
audio_1116.wav," I'm going to go to the next one. I'm going to go to the next one. I'm going to go to the next one. I'm going to go to the next one. My goal in life is to continuously learn and grow myself, while also helping others so that they can feel very happy. I would like to help others who are in need of something. I also start to make a positive impact on the world. I want to contribute myself for a better.",3.174896,"I'm going to go to the next one. I'm going to go to the next one. I'm going to go to the next one. I'm going to go to the next one. I'm going to go to the next one. I'm going to go to the next one. My goal in life is to continuously learn and grow myself, while also helping others so that they can feel very happy. I want to contribute myself for a better world."
audio_1240.wav," My favorite hobby is watching TV. Whenever I have free time, I love watching television. It never obstructs my studies. Of these helpers to expand our knowledge. And it teaches us several things. First I like to finish all my school homework and then start watching TV. This lightens my mood and structure the excitement inside me. As it increases my curiosity about the world, watching different useful stuff on TV enhances my knowledge, origins and gives me lots of joy. It is a good habit because watching TV escorts a lot of knowledge in various fields. There are several chonens and on TV which represent worldwide a phase. I watch with the news and I like chonens such as...",3.996298,"My favorite hobby is watching TV. Whenever I have free time, I love watching TV. It never obstructs my studies. It increases my curiosity about the world, and it enhances my knowledge, origins and gives me lots of joy. It is a good habit because watching TV escorts a lot of knowledge in various fields. There are several chonens and on TV which represent worldwide a phase. I watch with the news and I like chonens such as...."
audio_151.wav,,2.4925742,
audio_437.wav," of the swings. The scene of a school play, it's just, you know, pretty normal. It has swings, a slide, sandboxes, depending of, you know, the monkey bars, the things that the poles were just slide down, I'm not sure what they're called. You know, you hear a lot of noises of kids screaming or playing and running and, you know, talking to each other.",3.4003067,"You know, the scene of a school play is just pretty normal. It has swings, a slide, sandboxes, depending of, you know, the monkey bars, the things that the poles were just slide down, I'm not sure what they're called. You know, you hear a lot of noises of kids screaming or playing and running and, you know, talking to each other."
audio_1217.wav," Caponite market is really something. Many goods and item sales here that is very local to the country. Clothes, foods, exotic items. A lot of things that can be seen for daily belief parties, events. There's a lot of item stores as the trick or choose. The bustling crowd and noises. The bustling crowd and noises from cellar and buyers is kind of relaxing in fun. The crowd never change but the magnificent sight when the street lights start to eliminate the darkness of the night is so fascinating.",3.433057,The bustling crowd and noises from cellar and buyers is kind of relaxing in fun. The crowd never changes but the magnificent sight when the street lights start to eliminate the darkness of the night is so fascinating.
audio_831.wav, I'm sorry. I'm sorry. I'm sorry. I'm sorry. I'm sorry. I'm sorry. I'm sorry. I'm sorry. I'm sorry. I'm sorry. I'm sorry. I'm sorry. I'm sorry. I'm sorry. I'm sorry. I'm sorry.,3.2931037,I'm sorry. I'm sorry. I'm sorry. I'm sorry. I'm sorry. I'm sorry. I'm sorry. I'm sorry. I'm sorry. I'm sorry. I'm sorry. I'm sorry.
audio_1315.wav," So playground just really looks like there are a lot of playgrounds, there are a lot of swings, seaside slide in the middle of green grass. And there are usually the children who you will see them running, I'm chasing each other, you will also see them playing on the slide, on the sea saw, on the swing, you can also see them, they may be like dancing in the middle of the green grass, you can also see them playing any, you can also see them doing some exercise, or some, and for this time.",2.4914331,"So playground just really looks like there are a lot of playgrounds, there are a lot of swings, seaside slide in the middle of green grass. And there are usually the children who you will see them running, I'm chasing each other, you will also see them playing on the slide, on the sea saw, on the swing, you can also see them, they may be like dancing in the middle of the green grass, you can also see them doing some exercise, or some, and for this time."
audio_1323.wav," My favorite place to visit is a secluded beach on a remote island, the journey involves a combination of flights, motor rides and perhaps even a bit of hiking, heading to that adventure. Once there, the crystal clear waters and soft sandy beaches create a sea and atmosphere. Local sea food dishes like fish or kinesh and Arab Maastra, the islands grow in first with fresh flavors and unique spices looking everywhere today. Sunset Sun the Beach is simply breathtaking, the sky transforms into a canvas of vibrant hues, casting on magical gold over the landscape. It's a perfect time to enjoy and I appreciate the beauty of nature.",3.9206786,"My favorite place to visit is a secluded beach on a remote island, the journey involves a combination of flights, motor rides and perhaps even a bit of hiking, heading to that adventure. Once there, the crystal clear waters and soft sandy beaches create a sea and atmosphere. Local sea food dishes like fish or kinesh and Arab Maastra, the islands grow in first with fresh flavors and unique spices looking everywhere today. Sunset Sun the Beach is simply breathtaking, the sky transforms into a canvas of vibrant hues, casting on magical gold over the landscape. It's a perfect time to enjoy and I appreciate the beauty of nature."
audio_1256.wav," So my hobby is reading the Bible every day before sleeping before I go to bed. Every day I need to or I would like to learn and read one chapter in the Bible and there is a note for my hobby. I am enjoying the tree Bible and know something about it and that is helpful to live in my life and change everything after reading the Bible. And I also learned something about from that book that is some valuable things that they can change our diary loting. And that is how to talk with others, how to maintain your skills, how to learn, how to teach, how to live.",3.413453,"So my hobby is reading the Bible every day before sleeping before I go to bed. Every day I need to or I would like to learn and read one chapter in the Bible and there is a note for my hobby. I am enjoying the tree Bible and I also learned something about it that can change my diary loting. And that is how to talk with others, how to maintain your skills, how to learn, how to teach, and how to live."
